<?xml version="1.0" encoding="UTF-8"?>
<!ELEMENT directory (directory*, file*)>
<!ATTLIST directory name CDATA #REQUIRED>

<!ELEMENT file EMPTY>
<!ATTLIST file name CDATA #REQUIRED size CDATA #REQUIRED>
